{
  "system": "acme-elements",
  "generatedAt": "2026-09-04T13:06:25.325Z",
  "source": {
    "root": "examples/acme-elements",
    "files": [
      "examples/acme-elements/tokens.css"
    ],
    "adapter": "css-vars",
    "hash": "9247b7499bdbb2035be495253cde8c5b56643d080b17885f806ba3e8f08c5da7"
  },
  "tokens": [
    {
      "name": "--acme-brand-500",
      "cssVar": "--acme-brand-500",
      "value": "#2563eb",
      "category": "color"
    },
    {
      "name": "--acme-brand-600",
      "cssVar": "--acme-brand-600",
      "value": "#1d4ed8",
      "category": "color"
    },
    {
      "name": "--acme-color-accent-default",
      "cssVar": "--acme-color-accent-default",
      "value": "var(--acme-brand-500)",
      "valuesByTheme": {
        "light": "var(--acme-brand-500)",
        "dark": "#4f8ef7"
      },
      "category": "color",
      "references": [
        "--acme-brand-500"
      ]
    },
    {
      "name": "--acme-color-accent-emphasis",
      "cssVar": "--acme-color-accent-emphasis",
      "value": "var(--acme-brand-600)",
      "valuesByTheme": {
        "light": "var(--acme-brand-600)",
        "dark": "#7fb0fb"
      },
      "category": "color",
      "references": [
        "--acme-brand-600"
      ]
    },
    {
      "name": "--acme-color-border-default",
      "cssVar": "--acme-color-border-default",
      "value": "var(--acme-gray-300)",
      "valuesByTheme": {
        "light": "var(--acme-gray-300)",
        "dark": "#2b3641"
      },
      "category": "color",
      "references": [
        "--acme-gray-300"
      ]
    },
    {
      "name": "--acme-color-danger-default",
      "cssVar": "--acme-color-danger-default",
      "value": "var(--acme-danger-500)",
      "category": "color",
      "references": [
        "--acme-danger-500"
      ]
    },
    {
      "name": "--acme-color-success-default",
      "cssVar": "--acme-color-success-default",
      "value": "var(--acme-success-500)",
      "category": "color",
      "references": [
        "--acme-success-500"
      ]
    },
    {
      "name": "--acme-color-surface-default",
      "cssVar": "--acme-color-surface-default",
      "value": "var(--acme-gray-0)",
      "valuesByTheme": {
        "light": "var(--acme-gray-0)",
        "dark": "#171f27"
      },
      "category": "color",
      "references": [
        "--acme-gray-0"
      ]
    },
    {
      "name": "--acme-color-surface-sunken",
      "cssVar": "--acme-color-surface-sunken",
      "value": "var(--acme-gray-100)",
      "valuesByTheme": {
        "light": "var(--acme-gray-100)",
        "dark": "#11171d"
      },
      "category": "color",
      "references": [
        "--acme-gray-100"
      ]
    },
    {
      "name": "--acme-color-text-default",
      "cssVar": "--acme-color-text-default",
      "value": "var(--acme-gray-900)",
      "valuesByTheme": {
        "light": "var(--acme-gray-900)",
        "dark": "var(--acme-gray-0)"
      },
      "category": "color",
      "references": [
        "--acme-gray-900"
      ]
    },
    {
      "name": "--acme-color-text-muted",
      "cssVar": "--acme-color-text-muted",
      "value": "var(--acme-gray-600)",
      "valuesByTheme": {
        "light": "var(--acme-gray-600)",
        "dark": "#98a5b1"
      },
      "category": "color",
      "references": [
        "--acme-gray-600"
      ]
    },
    {
      "name": "--acme-color-warning-default",
      "cssVar": "--acme-color-warning-default",
      "value": "var(--acme-warning-500)",
      "category": "color",
      "references": [
        "--acme-warning-500"
      ]
    },
    {
      "name": "--acme-danger-500",
      "cssVar": "--acme-danger-500",
      "value": "#dc2626",
      "category": "color"
    },
    {
      "name": "--acme-duration-fast",
      "cssVar": "--acme-duration-fast",
      "value": "120ms",
      "category": "motion"
    },
    {
      "name": "--acme-duration-slow",
      "cssVar": "--acme-duration-slow",
      "value": "240ms",
      "category": "motion"
    },
    {
      "name": "--acme-font-size-lg",
      "cssVar": "--acme-font-size-lg",
      "value": "19px",
      "category": "typography"
    },
    {
      "name": "--acme-font-size-md",
      "cssVar": "--acme-font-size-md",
      "value": "15px",
      "category": "typography"
    },
    {
      "name": "--acme-font-size-sm",
      "cssVar": "--acme-font-size-sm",
      "value": "13px",
      "category": "typography"
    },
    {
      "name": "--acme-gray-0",
      "cssVar": "--acme-gray-0",
      "value": "#ffffff",
      "category": "color"
    },
    {
      "name": "--acme-gray-100",
      "cssVar": "--acme-gray-100",
      "value": "#f4f6f8",
      "category": "color"
    },
    {
      "name": "--acme-gray-300",
      "cssVar": "--acme-gray-300",
      "value": "#d6dde4",
      "category": "color"
    },
    {
      "name": "--acme-gray-600",
      "cssVar": "--acme-gray-600",
      "value": "#5b6b7a",
      "category": "color"
    },
    {
      "name": "--acme-gray-900",
      "cssVar": "--acme-gray-900",
      "value": "#18222c",
      "category": "color"
    },
    {
      "name": "--acme-radius-lg",
      "cssVar": "--acme-radius-lg",
      "value": "16px",
      "category": "radius"
    },
    {
      "name": "--acme-radius-md",
      "cssVar": "--acme-radius-md",
      "value": "8px",
      "category": "radius"
    },
    {
      "name": "--acme-radius-sm",
      "cssVar": "--acme-radius-sm",
      "value": "4px",
      "category": "radius"
    },
    {
      "name": "--acme-space-1",
      "cssVar": "--acme-space-1",
      "value": "4px",
      "category": "space"
    },
    {
      "name": "--acme-space-2",
      "cssVar": "--acme-space-2",
      "value": "8px",
      "category": "space"
    },
    {
      "name": "--acme-space-3",
      "cssVar": "--acme-space-3",
      "value": "12px",
      "category": "space"
    },
    {
      "name": "--acme-space-4",
      "cssVar": "--acme-space-4",
      "value": "16px",
      "category": "space"
    },
    {
      "name": "--acme-space-6",
      "cssVar": "--acme-space-6",
      "value": "24px",
      "category": "space"
    },
    {
      "name": "--acme-space-8",
      "cssVar": "--acme-space-8",
      "value": "32px",
      "category": "space"
    },
    {
      "name": "--acme-success-500",
      "cssVar": "--acme-success-500",
      "value": "#16a34a",
      "category": "color"
    },
    {
      "name": "--acme-warning-500",
      "cssVar": "--acme-warning-500",
      "value": "#d97706",
      "category": "color"
    }
  ],
  "cssVars": [
    "--acme-brand-500",
    "--acme-brand-600",
    "--acme-color-accent-default",
    "--acme-color-accent-emphasis",
    "--acme-color-border-default",
    "--acme-color-danger-default",
    "--acme-color-success-default",
    "--acme-color-surface-default",
    "--acme-color-surface-sunken",
    "--acme-color-text-default",
    "--acme-color-text-muted",
    "--acme-color-warning-default",
    "--acme-danger-500",
    "--acme-duration-fast",
    "--acme-duration-slow",
    "--acme-font-size-lg",
    "--acme-font-size-md",
    "--acme-font-size-sm",
    "--acme-gray-0",
    "--acme-gray-100",
    "--acme-gray-300",
    "--acme-gray-600",
    "--acme-gray-900",
    "--acme-radius-lg",
    "--acme-radius-md",
    "--acme-radius-sm",
    "--acme-space-1",
    "--acme-space-2",
    "--acme-space-3",
    "--acme-space-4",
    "--acme-space-6",
    "--acme-space-8",
    "--acme-success-500",
    "--acme-warning-500"
  ],
  "themes": [
    "dark",
    "light"
  ]
}
